Link,Cover,Title,Short Title,Chinese Title,Status,Author,Genre,Tags
https://www.mtlnovel.com/how-to-become-a-great-white-moonlight/,https://www.mtlnovel.net/uploads/2020/04/how-to-become-a-great-white-moonlight-180x240.jpg.webp,How To Become A Great White Moonlight,HBGWM,如何成为大佬的白月光,Dropped,月暮未央,"Adventure, Sci-fi, Shoujo","Female Protagonist, Reverse Harem, System Administrator, Transmigration"
https://www.mtlnovel.com/urban-supreme-dad/,https://www.mtlnovel.net/uploads/2020/04/Urban-Supreme-Dad-180x240.jpg.webp,Urban Supreme Dad,USD,都市至尊奶爸,Dropped,The Rest of Life,"Action, Fantasy, Xianxia",Protagonist Strong from the Start
https://www.mtlnovel.com/driver-of-the-beautiful-ceo/,https://www.mtlnovel.net/uploads/2020/04/driver-of-the-beautiful-ceo-180x240.jpg.webp,Driver of The Beautiful CEO,DTBC,美女总裁的代驾司机,Dropped,曾经是少年,"Drama, Romance","Arranged Marriage, Average-looking Protagonist, Beautiful Female Lead, Business Management, Contracts, Cute Story, Different Social Status, Famous Protagonist, Hard-Working Protagonist, Male Protagonist, Marriage of Convenience, Modern Day, Wealthy Characters"
https://www.mtlnovel.com/my-virtual-kingdom-of-god/,https://www.mtlnovel.net/uploads/2020/04/My-Virtual-Kingdom-of-God-180x240.jpg.webp,My Virtual Kingdom of God,MVKG,我的虚拟神国,Dropped,Little White Becomes Old White,Sci-fi,"Alternate World, Demons, Fan-fiction, Fanfiction, Fantasy World, Fast Cultivation, Gate to Another World, God Protagonist, Interdimensional Travel, Kingdom Building, Nationalism, Parallel Worlds, Racism, Unique Cultivation Technique, Urban, Virtual Reality"
https://www.mtlnovel.com/invincible-god-king/,https://www.mtlnovel.net/uploads/2020/04/Invincible-God-King-180x240.jpg.webp,Invincible God King,IGK,无敌神王,Dropped,Yue Liang Zhi Shang,"Action, Fantasy, Xuanhuan","Action, Age Progression, Character Development, Cultivation, eastern fantasy, Fantasy World, Hiding True Abilities, Martialarts, Orientalfantasy, Returningfrom Another World, Revenge, Special Abilities, Tragic Past, Weak to Strong, Wuxia, Xianxia, Xuanhuan"
https://www.mtlnovel.com/my-unlimited-gaming-system/,https://www.mtlnovel.net/uploads/2020/03/My-Unlimited-Gaming-System.jpg.webp,My Unlimited Gaming System,MUGS,我的无限游戏系统,Dropped,Dreaming About Worry-free,Sci-fi,"Fan-fiction, Fanfiction, Game Elements, Male Protagonist, System, System Administrator"
https://www.mtlnovel.com/i-can-report-everything/,https://www.mtlnovel.net/uploads/2020/03/I-Can-Report-Everything-180x240.jpg.webp,I Can Report Everything,ICRE,我能举报万物,Dropped,Must-fire,Urban Life,"Male Protagonist, Modern Day, System"
https://www.mtlnovel.com/i-can-absorb-everything/,https://www.mtlnovel.net/uploads/2020/03/I-Can-Absorb-Everything-180x240.jpg.webp,I Can Absorb Everything,ICAE,我能吸收万物,Dropped,Ancient Sun Tree,"Action, Adventure, Fantasy, Xuanhuan","Autism, Male Protagonist, System Administrator"
https://www.mtlnovel.com/divine-civilization/,https://www.mtlnovel.net/uploads/2020/03/Divine-Civilization-180x240.jpg.webp,Divine Civilization,DC,神级文明,Dropped,Impermanence,"Action, Adventure, Fantasy, Xuanhuan","Angels, Army Building, God Protagonist, Godly Powers, Harem, Kingdom Building, Polygamy, Poor to Rich, Wars, Weak to Strong"
https://www.mtlnovel.com/super-technology-extractor/,https://www.mtlnovel.net/uploads/2020/03/Super-Technology-Extractor-180x240.jpg.webp,Super Technology Extractor,STE,超级科技提取器,Dropped,Rotten Wood,Sci-fi,"Magical Technology, Male Protagonist, System"
https://www.mtlnovel.com/my-24-year-old-beautiful-boss/,https://www.mtlnovel.net/uploads/2020/03/My-24-year-old-Beautiful-Boss-180x240.jpg.webp,My 24-year-old Beautiful Boss,M24BB,我的24岁美女总裁,Dropped,Qing Tong Yin,"Romance, Urban Life","Bodyguards, Harem, Rape Victim Becomes Lover"
https://www.mtlnovel.com/almighty-leveling-system/,https://www.mtlnovel.net/uploads/2020/03/Almighty-Leveling-System-180x240.jpg.webp,Almighty Leveling System,ALS,全能升级系统,Dropped,Yi Long,Urban Life,"Action, beautiful heroine, Character Development, Cultivation, Destiny, Eunuch, Identity Crisis, Level System, Martial arts, Modern Day, Murder, Nightmare, Revenge, Second Chance, Slow Romance, Special Abilities, Teamwork, Tragic Past, Trap, Tsundere, Urban, Weak to Strong"
https://www.mtlnovel.com/the-days-of-cultivating-immortal/,https://www.mtlnovel.net/uploads/2020/03/the-days-of-cultivating-immortal-180x240.jpg.webp,The Days of Cultivating Immortal,TDCI,打卡修仙的日子,Dropped,光月蝶衣,"Action, Adventure, Drama, Fantasy, Harem, Historical, Josei, Martial Arts, Mystery, Romance","Cultivation, Immortals"
https://www.mtlnovel.com/emperor-royal-highness-enchanting/,https://www.mtlnovel.net/uploads/2020/03/emperor-royal-highness-enchanting.jpg.webp,Emperor Royal Highness Enchanting,ERHE,逆天神女：帝君殿下太妖娆,Dropped,One Wooden Boat,"Adventure, Fantasy, Mystery, Romance, Xuanhuan","Aristocracy, Betrayal, Black Belly, Female Protagonist, Magic, Reincarnated in Another World"
https://www.mtlnovel.com/technological-hegemony/,https://www.mtlnovel.net/uploads/2020/03/Technological-Hegemony-180x240.jpg.webp,Technological Hegemony,TH,科技霸权,Dropped,Nine Light Years Per Second,Sci-fi,"Aliens, Androids, Artificial Intelligence, Evolution, Nationalism, Poor to Rich, Technological Gap"
https://www.mtlnovel.com/i-pick-the-attributes-from-the-stone/,https://www.mtlnovel.net/uploads/2020/03/I-Pick-the-Attributes-from-the-Stone-180x240.jpg.webp,I Pick the Attributes from the Stone,IPAS,我从石头里面捡属性,Dropped,Phantom Pebble,"Fantasy, Xuanhuan","Male Protagonist, System"
https://www.mtlnovel.com/just-let-me-die/,https://www.mtlnovel.net/uploads/2020/03/just-let-me-die-180x240.jpg.webp,Just Let Me Die (I Really Just Want to Die),JLMD,我真的只是想寻死 / I Really Just Want to Die,Dropped,Lamu,"Action, Comedy, Martial Arts, Xuanhuan","Fast Cultivation, Male Protagonist"
https://www.mtlnovel.com/personal-wife-of-the-king/,https://www.mtlnovel.net/uploads/2020/03/Personal-Wife-of-the-King-180x240.jpg.webp,Personal Wife of the King,PWK,贴身兵王的总裁老婆,Dropped,Eastern Priest,Urban Life,"Beautiful Female Lead, Handsome Male Lead, Harem, Male Protagonist, Protagonist Strong from the Start, Strong to Stronger"
https://www.mtlnovel.com/naruto-i-can-reach-the-full-level-with-one-click/,https://www.mtlnovel.net/uploads/2020/03/Naruto-I-Can-Reach-the-Full-Level-with-One-Click-180x240.jpg.webp,Naruto: I Can Reach the Full Level with One Click (Naruto: One-click Upgrade),ICRFLOC,火影：我能一键满级 / Naruto: One-click Upgrade,Dropped,Fall in love with handkerchief paper,"Fan-Fiction, Two-dimensional","Eye Powers, Fan-fiction, Fanfiction, Harem, Naruto, One Piece, Overpowered Protagonist, System, System Administrator, World Travel"
https://www.mtlnovel.com/black-dragon-code/,https://www.mtlnovel.net/uploads/2020/03/Black-Dragon-Code-180x240.jpg.webp,Black Dragon Code,BDC,黑龙法典,Dropped,Cheers,"Two-dimensional, Urban Life","Clever Protagonist, Cunning Protagonist, Dragons, Dwarfs, Elves, Fantasy World, Non-humanoid Protagonist, Orcs, Reincarnated as a Monster, Reincarnated in Another World"
https://www.mtlnovel.com/i-was-born-in-hell/,https://www.mtlnovel.net/uploads/2020/03/I-was-Born-in-Hell-180x240.jpg.webp,I was Born in Hell,IWBIH,我在地狱中诞生,Dropped,Justice Di,Sci-fi,"Apocalypse, Cold Protagonist, Cruel Characters, Dark, Evil Protagonist, Post-apocalyptic, Ruthless Protagonist, Second Chance, Strong from the Start, Strong to Stronger"
https://www.mtlnovel.com/uplifting-journey/,https://www.mtlnovel.net/uploads/2020/03/Uplifting-Journey-180x240.jpg.webp,Uplifting Journey,UJ,升维之旅,Dropped,Knowledge and Truth,"Adventure, Sci-fi","Fan-fiction, Male Protagonist, Parallel Worlds, Racism, Scientists, World Travel"
https://www.mtlnovel.com/i-am-the-god-of-games/,https://www.mtlnovel.net/uploads/2020/03/i-am-the-god-of-games-180x240.jpg.webp,I Am the God of Games,IAGG,吾乃游戏神,Dropped,Green Pepper Bat Donburi,"Action, Game","Alchemy, Comedic Undertone, Different Social Status, Elves, Game Elements, God Protagonist, Gods, Kingdom Building, Kingdoms, Knights, Level System, Multiple POV, Multiple Protagonists, Priestesses, Priests, Saints, System Administrator, Transported to Another World"
https://www.mtlnovel.com/undead-mage-in-the-end-times/,https://www.mtlnovel.net/uploads/2020/03/Undead-Mage-in-the-End-Times-180x240.jpg.webp,Undead Mage in the End Times,UMET,亡灵法师在末世,Dropped,Fu Si,Sci-fi,"Aliens, Apocalypse, Army Building, Cautious Protagonist, Cruel Characters, Depictions of Cruelty, Evolution, Game Elements, Male Protagonist, Mutated Creatures, Necromancer, Post-apocalyptic, Summoning Magic, Weak to Strong, Zombies"
https://www.mtlnovel.com/i-use-game-world-to-farm/,https://www.mtlnovel.net/uploads/2020/03/I-Use-Game-World-to-Farm-180x240.jpg.webp,I Use Game World to Farm,IUGWTF,我用游戏世界种田,Dropped,Fish Farming on Mars,Sci-fi,"Fan-fiction, Fanfiction, Farming, Game Elements, Gate to Another World, Interdimensional Travel, Magical Space, Male Protagonist, Nationalism, Racism, Survival Game, Technological Gap, Time Travel, World Hopping, World Travel"
https://www.mtlnovel.com/super-gene-hunting-ground/,https://www.mtlnovel.net/uploads/2020/03/Super-Gene-Hunting-Ground-180x240.jpg.webp,Super Gene Hunting Ground,SGHG,超级基因猎场,Dropped,Binggo,"Action, Adventure, Fantasy, Xuanhuan","Apocalypse, Futuristic Setting, Genetic Modifications, Harem, Monsters, Polygamy, Weak to Strong"
https://www.mtlnovel.com/manipulation-of-everything/,https://www.mtlnovel.net/uploads/2020/03/Manipulation-of-Everything-180x240.jpg.webp,Manipulation of Everything,MoE,万物操控,Dropped,Four Perling,Sci-fi,"Apocalypse, Male Protagonist, Second Chance, Siblings, Zombies"
https://www.mtlnovel.com/rebirth-of-the-wealthy-american/,https://www.mtlnovel.net/uploads/2020/03/Rebirth-of-the-Wealthy-American-180x240.jpg.webp,Rebirth of the Wealthy American,RWA,重生美国之富甲天下,Dropped,Catfish Head,Historical,"Cruel Characters, Nationalism, Racism"
https://www.mtlnovel.com/super-insight-system/,https://www.mtlnovel.net/uploads/2020/03/super-insight-system-180x240.jpg.webp,Super Insight System,SIS,超级慧眼系统,Dropped,The Distressed Cigarette,"Action, Adventure, Fantasy, Horror, Martial Arts","Early Romance, Elemental Magic, Fantasy Magic, Game Elements, Harem, Late Romance, Magic, Male Protagonist, Martial arts, Polygamy, System Administrator, Weak to Strong, World Hopping, World Travel, Younger Brothers, Younger Sisters"
https://www.mtlnovel.com/the-glamorous-plump-princess/,https://www.mtlnovel.net/uploads/2020/03/the-glamorous-plump-princess-180x240.jpg.webp,The Glamorous Plump Princess,GPP,肥妃如此多娇,Dropped,Crunchy Candy,"Drama, Romance","Arrogant Characters, Clever Protagonist, Reincarnation, Ugly to Beautiful"
https://www.mtlnovel.com/i-have-refined-qi-for-3000-years/,https://www.mtlnovel.net/uploads/2020/03/i-have-refined-qi-for-3000-yearsjpeg-180x240..webp,I Have Refined Qi For 3000 Years!,,炼气练了三千年,Dropped,精装激光雕刻机,"Action, Adventure, Comedy, Fantasy, Harem, Romance, Xianxia","Adapted to Manhua, Body Tempering, Cultivation, Handsome Male Lead, Male Protagonist, Overpowered Protagonist, Protagonist Strong from the Start, Sexual Cultivation Technique, Time Travel"
https://www.mtlnovel.com/dragon-ball-twelve-modifiers/,https://www.mtlnovel.net/uploads/2020/03/Dragon-Ball-Twelve-Modifiers.jpg.webp,Dragon Ball Twelve Modifiers,DBTM,龙珠之十二项修改器,Dropped,Zhuanzai,"Action, Adventure, Fan-Fiction, Fantasy, Xuanhuan","Fanfiction, Overpowered Protagonist"
https://www.mtlnovel.com/one-piece-invincible/,https://www.mtlnovel.net/uploads/2020/02/one-piece-invincible.jpg.webp,One Piece Invincible,OPI,海贼王之碎片提取系统,Dropped,我是科学家,"Action, Adventure, Fantasy, Harem, Supernatural","Cheats, Fan-fiction, Fanfiction, Fleet Battles, Game Elements, Harem, Multiple Realms, Naruto, Nationalism, One Piece, Overpowered Protagonist, System Administrator, Transported to Another World, World Travel"
https://www.mtlnovel.com/rebirth-of-the-world-traveller/,https://www.mtlnovel.net/uploads/2020/02/rebirth-of-the-world-traveller-180x240.jpg.webp,Rebirth of the World Traveller,RWT,重生之无限位面穿越,Dropped,My Smoke,"Action, Fantasy","Male Protagonist, Overpowered Protagonist, World Travel"
https://www.mtlnovel.com/strongest-invincible-brat/,https://www.mtlnovel.net/uploads/2020/02/Strongest-Invincible-Brat-180x240.jpg.webp,Strongest Invincible Brat,SIB,最强无敌熊孩子,Dropped,Tease in Sorrow,"Action, Adventure, Martial Arts, Slice of Life, Xuanhuan","Alchemy, Arrogant Characters, Cheats, Child Protagonist, Cultivation, Cute Protagonist, Fast Cultivation, Male Protagonist, Poor to Rich, Shameless Protagonist, System, Unique Cultivation Technique, Weak to Strong"
https://www.mtlnovel.com/naruto-shikigami-aizen/,https://www.mtlnovel.net/uploads/2020/02/Naruto-Shikigami-Aizen-180x240.jpg.webp,Naruto Shikigami Aizen (Sousuke Aizen of Naruto),NSA,火影之蓝染忽右介 / Sousuke Aizen of Naruto,Dropped,Tibetan Sword,"Action, Adventure, Fan-Fiction, Fantasy, Martial Arts, Supernatural, Two-dimensional, Xuanhuan","Cautious Protagonist, Cunning Protagonist, Fan-fiction, Fanfiction, Multiple Realms, Naruto, Transmigration"
https://www.mtlnovel.com/kidnapping-all-mankind/,https://www.mtlnovel.net/uploads/2020/02/kidnapping-all-mankind-180x240.jpg.webp,Kidnapping All Mankind,KAM,绑架全人类,Dropped,Early Morning's Little Rain,"Action, Adventure, Sci-fi",Male Protagonist
https://www.mtlnovel.com/holy-institution/,https://www.mtlnovel.net/uploads/2020/02/holy-institution-180x240.jpg.webp,Holy Institution,HI,圣院,Dropped,Su Youbing,"Comedy, Fantasy, Romance, Shounen Ai","Calm Protagonist, Elemental Magic, Handsome Male Lead, Magic, Male Protagonist, Slow Romance, Strong Love Interests, Student-Teacher Relationship, Weak to Strong"
https://www.mtlnovel.com/tempests-of-a-foreign-world/,https://www.mtlnovel.net/uploads/2020/02/tempests-of-a-foreign-world-180x240.jpg.webp,Tempests of a Foreign World,TFW,异世界暴风雨,Dropped,Bi Shen,"Action, Fantasy","Demons, Dwarfs, Elves, Male Protagonist"
https://www.mtlnovel.com/full-time-anomaly/,https://www.mtlnovel.net/uploads/2020/02/full-time-anomaly-180x240.jpg.webp,Full-time Anomaly,FTA,全职怪才,Dropped,吃李子上火,"Action, Adventure, Harem, Romance","Assassins, Handsome Male Lead, Hiding True Identity, Male Protagonist, Modern Day, Parody, Shameless Protagonist"
https://www.mtlnovel.com/the-esports-kings-crush/,https://www.mtlnovel.net/uploads/2020/02/the-esports-king-s-crush-180x240.jpg.webp,The eSports King’s Crush,EKC,电竞大神暗恋我,Dropped,Warring Young Seven,"Action, Romance","Calm Protagonist, e-Sports, Early Romance, Female Protagonist, Gaming/E-Sport, Handsome Male Lead, Hiding True Identity, Popular Love Interests"
https://www.mtlnovel.com/saint-ancestor-of-void-extreme/,https://www.mtlnovel.net/uploads/2020/02/Saint-Ancestor-of-Void-Extreme-180x240.jpg.webp,Saint Ancestor of Void Extreme,SAVE,太虚圣祖,Dropped,A More Water,"Action, Adventure, Fantasy, Martial Arts, Xuanhuan","Cultivation, Martial arts, Rebirth, Weak to Strong"
https://www.mtlnovel.com/martial-inverse/,https://www.mtlnovel.net/uploads/2020/02/martial-inverse-180x240.jpg.webp,Martial Inverse,MI,武逆,Dropped,Merely a Small Fry,"Action, Adventure, Fantasy, Harem, Martial Arts, Xianxia","Academy, Adapted to Manhwa, Alchemy, Arrogant Characters, Artifacts, Beast Companions, Beasts, Beautiful Female Lead, Bloodlines, Body Tempering, Character Growth, Clever Protagonist, Confident Protagonist, Cultivation, Dao Comprehension, Determined Protagonist, Dragons, Earth Invasion, Emotionally Weak Protagonist, Enlightenment, Eye Powers, Fast Cultivation, Fast Learner, Genius Protagonist, Hard-Working Protagonist, Harsh Training, Heavenly Tribulation, Herbalist, Hidden Abilities, Hot-blooded Protagonist, Long Separations, Lucky Protagonist, Male Protagonist, Medical Knowledge, Multiple Realms, Mysterious Family Background, Naive Protagonist, Personality Changes, Pets, Phoenixes, Polygamy, Poor Protagonist, Pregnancy, Rape, Rape Victim Becomes Lover, Rebirth, Revenge, Strong Love Interests, Sudden Strength Gain, Transformation Ability, Unique Cultivation Technique, Weak to Strong"
https://www.mtlnovel.com/fruit-tycoon/,https://www.mtlnovel.net/uploads/2020/02/Fruit-tycoon-cover-180x240.jpg.webp,Fruit Tycoon,FT,水果大佬,Dropped,二蛇,"Comedy, Supernatural","Business Management, Game Elements, Level System, Male Protagonist, Modern Day"
https://www.mtlnovel.com/dan-martial-evil-sovereign/,https://www.mtlnovel.net/uploads/2020/02/dan-martial-evil-sovereign-180x240.jpg.webp,Dan Martial Evil Sovereign,DMES,丹武邪尊,Dropped,Li Zhong You Meng,"Action, Fantasy, Harem, Martial Arts, Mature, Xuanhuan","Androgynous Characters, Clan Building, Depictions of Cruelty, Fantasy World, Fast Cultivation, Late Romance, Male Protagonist, Medical Knowledge, Pill Concocting, Rebirth, Revenge, Ruthless Protagonist, Second Chance, Strong from the Start, Strong to Stronger, Time Travel"
https://www.mtlnovel.com/miracle-doctor-princess/,https://www.mtlnovel.net/uploads/2020/02/miracle-doctor-princess-180x240.jpg.webp,Miracle Doctor Princess,MDP,一医成瘾：神医王妃,Dropped,Mu Jiu Yan,"Comedy, Josei, Romance","Doctors, Female Protagonist, Lovers Reunited, Reincarnated in Another World, Transmigration"
https://www.mtlnovel.com/my-cold-and-beautiful-ceo/,https://www.mtlnovel.net/uploads/2020/02/my-cold-and-beautiful-ceo-180x240.jpg.webp,My Cold And Beautiful CEO,MCABC,我的冰山美女总裁,Dropped,Mo Wang Chu Xin,"Harem, Martial Arts, Romance","Beautiful Female Lead, Harem, Harem-seeking Protagonist, Harem-seeking Protagonist Harsh Training, Imperial Harem, Office Romance, Polygamy"
https://www.mtlnovel.com/rebirth-of-the-super-thief/,https://www.mtlnovel.net/uploads/2020/02/rebirth-of-the-super-thief.jpg.webp,Rebirth of the Super Thief,ROTST,重生之超级盗贼,Dropped,Origin Of A Tune,"Action, Adventure, Fantasy, Romance, Sci-fi","Clever Protagonist, Dragons, Dwarfs, Elves, Guilds, Male Protagonist, Marriage, MMORPG, Reincarnation, Second Chance, Sword And Magic, Thieves, Virtual Reality"
https://www.mtlnovel.com/scattered-immortal/,https://www.mtlnovel.net/uploads/2020/02/scattered-immortal-180x240.jpg.webp,Scattered Immortal,(Rogue Immortal),最散仙,Dropped,Nine Snort,"Action, Adventure, Fantasy, Harem, Martial Arts, Xianxia","Arrogant Characters, Artifacts, Beast Companions, Beautiful Female Lead, Body Tempering, Calm Protagonist, Carefree Protagonist, Clever Protagonist, Confident Protagonist, Cultivation, Dao Companion, Dao Comprehension, Early Romance, Evil Protagonist, Famous Protagonist, Fast Cultivation, Handsome Male Lead, Heavenly Tribulation, Hiding True Abilities, Hiding True Identity, Immortals, Kuudere, Lazy Protagonist, Magic Formations, Male Protagonist, Marriage, Mature Protagonist, Misunderstandings, Monsters, Multiple Realms, Overpowered Protagonist, Past Plays a Big Role, Personality Changes, Polygamy, Protagonist Strong from the Start, Rape, Rape Victim Becomes Lover, Reverse Rape, Romantic Subplot, Ruthless Protagonist, Shameless Protagonist, Sharp-tongued Characters, Strength-based Social Hierarchy, Strong Love Interests, Tsundere, Underestimated Protagonist, Unique Cultivation Technique"
https://www.mtlnovel.com/number-one-player-of-time-and-space/,https://www.mtlnovel.net/uploads/2020/02/Number-One-Player-of-Time-and-Space-180x240.jpg.webp,Number One Player of Time and Space,NOPTS,时空之头号玩家,Dropped,Feng Shangren,Sci-fi,"Adventurers, Beast Companions, Bloodlines, Cheats, Death, Fan-fiction, Fanfiction, Fantasy World, Game Elements, Gate to Another World, Harem, Loner Protagonist, Long Separations, Male Protagonist, Resurrection, Second Chance, System, Zombies"
https://www.mtlnovel.com/harry-potter-and-the-rise-of-the-ordinary-person/,https://www.mtlnovel.net/uploads/2020/02/harry-potter-and-the-rise-of-the-ordinary-person.jpg.webp,Harry Potter and the Rise of the Ordinary Person,,哈利波特之凡人的崛起,Dropped,Caped Baldy,"Action, Adventure, Fantasy, Romance, Supernatural, Xuanhuan","Academy, Age Progression, Books, Calm Protagonist, Cautious Protagonist, Clever Protagonist, Confident Protagonist, Cooking, Cunning Protagonist, Eidetic Memory, Fanfiction, Fantasy Creatures, Fantasy World, Fast Learner, Genius Protagonist, Hard-Working Protagonist, Harry Potter, Hidden Abilities, Hiding True Abilities, Magic, Magic Beasts, Male Protagonist, Manipulative Characters, Phoenixes, Politics, Schemes And Conspiracies, Transmigration, Transported to Another World, Weak to Strong, Wizards"
https://www.mtlnovel.com/problematic-sister-fell-in-love-with-me/,https://www.mtlnovel.net/uploads/2020/01/problematic-sister-fell-in-love-with-me-180x240.jpg.webp,Problematic Sister Fell In Love With Me,,问题妹妹恋上我,Dropped,负是非,"Comedy, Drama, Harem, Romance, School Life, Seinen","Brother Complex, Harem, Male Protagonist, Otaku, Sister Complex, Tsundere, Younger Sisters"
https://www.mtlnovel.com/a-straight-guys-nightmare/,https://www.mtlnovel.net/uploads/2020/02/a-straight-guy-s-nightmare-180x200.jpg.webp,A Straight Guy’s Nightmare,ASGN,直男噩梦,Dropped,Gaga Duck,"Gender Bender, Harem, Smut, Yaoi","Anal, BDSM, Blackmail, Fellatio, First-time Intercourse, Futanari, Love Interest Falls in Love First, Modern Day, Mpreg, Pregnancy, R-18, Rape, Reverse Harem, Stockholm Syndrome, Straight Uke, Threesome"
https://www.mtlnovel.com/pastoral-honey-pet-farmers-hot-little-lady/,https://www.mtlnovel.net/uploads/2020/01/pastoral-honey-pet-farmer-s-hot-little-lady-180x240.jpg.webp,Pastoral Honey Pet: Farmer’s Hot Little Lady,,田园蜜宠：农家小娘子火辣辣,Dropped,念已伤,"Comedy, Harem, Historical, Romance, Shoujo, Slice of Life","Adapted to Manhua, Ancient Times, Farming, Female Protagonist, Polyandry, Poor Protagonist, Poor to Rich, Reverse Harem, Transmigration"
https://www.mtlnovel.com/heavens-will-balancing-system/,https://www.mtlnovel.net/uploads/2020/01/heaven-s-will-balancing-system-180x240.jpg.webp,Heaven’s Will Balancing System,HWBS,天道平衡系统,Dropped,Fei Sheng,"Action, Adventure, Comedy, Fantasy, Martial Arts, Xuanhuan","Age Progression, Ancient Times, Appearance Changes, Battle Academy, Beasts, Bloodlines, Body Tempering, Cheats, Child Protagonist, Cultivation, Elemental Magic, Fantasy World, Game Elements, Harem-seeking Protagonist, Immortals, Level System, Magic Beasts, Male Protagonist, Mature Protagonist, Modern Knowledge, Multiple Realms, Mutated Creatures, Orphans, Saving the World, Schemes And Conspiracies, Special Abilities, Sword And Magic, System Administrator, Transmigration, Transported to Another World, Wars, Weak Protagonist"
https://www.mtlnovel.com/im-an-olympic-superstar/,https://www.mtlnovel.net/uploads/2020/01/i-m-an-olympic-superstar-180x240.jpg.webp,I’m an Olympic Superstar,IOS,我是奥运大明星,Dropped,干煸鱿鱼须,"Comedy, Harem, Sports","e-Sports, Gamers, Male Protagonist, System Administrator, Transmigration"
https://www.mtlnovel.com/jubo/,https://www.mtlnovel.net/uploads/2020/01/jubo-180x240.jpg.webp,Jubo,,巨擘,Dropped,Yin Ya,"Comedy, Romance, Slice of Life, Yaoi","Devoted Love Interests, Misunderstandings, Modern Day, Mpreg, Poor to Rich, Wealthy Characters"
https://www.mtlnovel.com/fantasy-world-transmigration/,https://www.mtlnovel.net/uploads/2020/01/fantasy-world-transmigration.jpg.webp,Fantasy World Transmigration,FWT,幻想世界大穿越,Dropped,辰一十一,"Action, Adventure, Fantasy, Martial Arts, Psychological, Sci-fi, Supernatural, Xuanhuan","Anti-social Protagonist, Antihero Protagonist, Apathetic Protagonist, Calm Protagonist, Clever Protagonist, Cold Protagonist, Cunning Protagonist, Evil Protagonist, Fast Learner, Genius Protagonist, God Protagonist, Godly Powers, Male Protagonist, Marvel, Mature Protagonist, Modern Day, Movies, Overpowered Protagonist, Ruthless Protagonist, Secretive Protagonist, Strong to Stronger, Transmigration, Wars, Wealthy Characters, World Travel"
https://www.mtlnovel.com/demons-beside-you/,https://www.mtlnovel.net/uploads/2020/01/demons-beside-you-180x240.jpg.webp,Demons Beside You (The Demons Beside Me),DBY,恶魔就在身边 / The Demons Beside Me,Dropped,汉宝,"Fantasy, Supernatural","Angels, Animal Rearing, Cautious Protagonist, Cheats, Clever Protagonist, Comedic Undertone, Cruel Characters, Cultivation, Demons, Devoted Love Interests, Doctors, Early Romance, Elemental Magic, Evil Organizations, Evil Religions, Hell, Legends, Magic, Magic Beasts, Male Protagonist, Modern Day, Monsters, Mysterious Family Background, Mysterious Past, Necromancer, Overpowered Protagonist, Pets, Poor to Rich, Romantic Subplot, Ruthless Protagonist, Seven Deadly Sins, Slow Growth at Start, Souls, Special Abilities, Summoning Magic, Superpowers, Weak to Strong, Witches"
