Link,Cover,Title,Short Title,Chinese Title,Status,Author,Genre,Tags
https://www.mtlnovel.com/im-the-king-of-technology/,https://www.mtlnovel.net/uploads/2020/08/Im-the-King-Of-Technology-180x240.jpg.webp,I’m the King Of Technology,IKT,,Dropped,lumydee,Fantasy,"Aristocracy, Army, Army Building, Assassins, Beautiful Female Lead, Business Management, Calm Protagonist, Clever Protagonist, Cunning Protagonist, Determined Protagonist, Fallen Nobility, Famous Protagonist, Farming, Game Elements, Handsome Male Lead, Hard-Working Protagonist, Industrialization, Kingdom Building, Kingdoms, Kingdoms Knights, Low-key Protagonist, Loyal Subordinates, Male Protagonist, Military, Multiple POV, Nobles, Overpowered Protagonist, Racism, Reincarnated in Another World, Royalty, Ruthless Protagonist, Schemes And Conspiracies, Slaves, Slow Romance, Strategic Battles, Strong to Stronger, System, System Administrator, Technological Gap, Transmigration, Weak to Strong"
https://www.mtlnovel.com/my-infinite-monster-clone/,https://www.mtlnovel.net/uploads/2020/08/My-Infinite-Monster-Clone-180x240.jpg.webp,My Infinite Monster Clone,MIMC,我的无限怪兽分身,Dropped,Dao Zhi,Sci-fi,"Accelerated Growth, Apocalypse, Army, Army Building, Fast Cultivation, Gate to Another World, Generals, Magical Space, Military, Mutated Creatures, Overpowered Protagonist, Parallel Worlds, Protagonist Strong from the Start, Second Chance, Strong to Stronger, System, Time Skip, Wars"
https://www.mtlnovel.com/the-heavens-jailer/,https://www.mtlnovel.net/uploads/2020/08/The-Heavens-Jailer-2-180x240.jpg.webp,The Heaven’s Jailer,THJ,天庭小狱卒,Dropped,Ling Jiu Er Wu,Urban Life,"Cooking, Cultivation, Harem, Lucky Protagonist, Male Protagonist, Modern Day, Naive Protagonist, Poor to Rich, Prison, Schemes And Conspiracies, Weak to Strong"
https://www.mtlnovel.com/magic-apprentice-2/,https://www.mtlnovel.net/uploads/2020/08/Magic-Apprentice-180x240.jpg.webp,Magic Apprentice,MA,魔法学徒,Dropped,aquamarine,"Action, Adventure, Comedy, Fantasy, Harem, Martial Arts, Xuanhuan",
https://www.mtlnovel.com/tales-of-the-reincarnated-lord/,https://www.mtlnovel.net/uploads/2020/08/tales-of-the-reincarnated-lord.jpg.webp,Tales of the Reincarnated Lord,TRL,重生之领主传奇,Dropped,Smoke Is A Path,"Action, Fantasy, Harem, Mature","Academy, Archery, Aristocracy, Army Building, Arrogant Characters, Beasts, Betrayal, Calm Protagonist, Cunning Protagonist, Depictions of Cruelty, Domestic Affairs, Farming, Firearms, Friendship, Hard-Working Protagonist, Harem, Kingdom Building, Kingdoms, Knights, Late Romance, Leadership, Loyal Subordinates, Magic Beasts, Maids, Male Protagonist, Management, Marriage, Martial arts, Mature Protagonist, Medieval, Mercenaries, Military, Modern Knowledge, Nobles, Past Plays a Big Role, Politics, Polygamy, Pregnancy, R-18, Rape, Reverse Rape, Romantic Subplot, Royalty, Ruthless Protagonist, Slaves, Strategic Battles, Strategist, Transmigration, Transported to Another World, Underestimated Protagonist, Unique Cultivation Technique, Wars, Xuanhuan"
https://www.mtlnovel.com/im-a-pokemon-trainer-in-a-parallel-world/,https://www.mtlnovel.net/uploads/2020/08/Im-a-Pokemon-Trainer-in-a-Parallel-World-180x240.jpg.webp,I’m a Pokemon Trainer in a Parallel World,IPTIPW,在平行世界当精灵训练师,Dropped,I believe in Ke Xue,"Action, Adventure, Comedy, Fan-Fiction, Fantasy, Supernatural","Accelerated Growth, Fan-fiction, Fanfiction, Pokemon"
https://www.mtlnovel.com/pirates-infinite-wings/,https://www.mtlnovel.net/uploads/2020/08/Pirates-Infinite-Wings-180x240.jpg.webp,Pirate’s Infinite Wings,PIW,海贼之无限翅膀,Dropped,Flowering on the Lingshang,"Erciyuan, Fan-Fiction, Two-dimensional","Fan-fiction, Fanfiction, Harem, Harem-seeking Protagonist, Magic, One Piece, Pirates, World Hopping"
https://www.mtlnovel.com/apocalyptic-capsule-system/,https://www.mtlnovel.net/uploads/2020/08/Apocalypse-Capsule-System-180x240.jpg.webp,Apocalyptic Capsule System,ACS,末世胶囊系统,Dropped,Old Li Jindao,Sci-fi,"Apocalypse, Cold Protagonist, Evolution, Male Protagonist, Monsters, Ruthless Protagonist, Special Abilities, System, System Administrator, Weak to Strong, Zombies"
https://www.mtlnovel.com/fleet-commander/,https://www.mtlnovel.net/uploads/2020/08/Fleet-Commander-180x240.jpg.webp,Fleet Commander,FC,舰队司令,Dropped,Excessive scalp,"Game, Yaoi","Academy, Cowardly Protagonist, Fat Protagonist, Weak Protagonist"
https://www.mtlnovel.com/modern-cultivation-record/,https://www.mtlnovel.net/uploads/2020/08/Modern-Cultivation-Record.jpg.webp,Modern Cultivation Record,MCR,现代修仙录,Dropped,Jindan Avenue,"Fantasy, Xianxia","Modern Day, Modern World"
https://www.mtlnovel.com/becoming-a-monk-in-tokyo/,https://www.mtlnovel.net/uploads/2020/08/Becoming-A-Monk-In-Tokyo-180x240.jpg.webp,Becoming A Monk In Tokyo,BAMIT,我在东京当和尚,Dropped,Doomsday Pigeon,"Fantasy, Xuanhuan","Buddhism, Overpowered Protagonist"
https://www.mtlnovel.com/my-life-starts-with-spending-money/,https://www.mtlnovel.net/uploads/2020/08/My-Life-Starts-with-Spending-Money-180x240.jpg.webp,My Life Starts with Spending Money,MLSWSM,我的人生从花钱开始,Dropped,Dangdang loud,Urban Life,"Fat Protagonist, Fat to Fit, Lazy Protagonist, Otaku, Poor to Rich, Sudden Wealth, System"
https://www.mtlnovel.com/invincible-dragon-development-system/,https://www.mtlnovel.net/uploads/2020/08/Invincible-Dragon-Development-System-180x240.jpg.webp,Invincible Dragon Development System,IDDS,无敌神龙养成系统,Dropped,993,Urban Life,"Academy, Army Building, Arrogant Characters, Beasts, Beautiful Female Lead, Business Management, Businessmen, Calm Protagonist, Clan Building, Clever Protagonist, Cunning Protagonist, Determined Protagonist, Dragons, eastern fantasy, Eye Powers, Famous Protagonist, Game Elements, Hard-Working Protagonist, Harem, Kingdom Building, Low-key Protagonist, Loyal Subordinates, Male Protagonist, Master-Disciple Relationship, Medical Knowledge, Modern Day, Money Grubber, Poor to Rich, Race Change, Romantic Subplot, Sect Development, System Administrator, Underestimated Protagonist, Urban, Weak to Strong, Younger Sisters"
https://www.mtlnovel.com/building-b/,https://www.mtlnovel.net/uploads/2020/07/Building-B-180x240.jpg.webp,Building B,BB,楼乙,Dropped,Keep watch,"Fantasy, Martial Arts, Xianxia",
https://www.mtlnovel.com/harry-potters-death-authority/,https://www.mtlnovel.net/uploads/2020/07/Harry-Potters-Death-Authority-180x240.jpg.webp,Harry Potter’s Death Authority,HPDA,哈利波特之死神权柄,Dropped,Ji Yeyu,"Fan-Fiction, Fantasy, Xuanhuan","Fan-fiction, Fanfiction, Harry Potter, Magic, Wizards"
https://www.mtlnovel.com/imperial-ceo-sweet-sweet-love/,https://www.mtlnovel.net/uploads/2020/07/Imperial-CEO-Sweet-Sweet-Love-180x240.jpg.webp,Imperial CEO Sweet Sweet Love (CEO Hubby's Sweet Love),ICSSL,老公宠妻太甜蜜 / CEO Hubby's Sweet Love,Dropped,Yi Mi,Romance,Female Protagonist
https://www.mtlnovel.com/online-games-barbarism-and-civilization/,https://www.mtlnovel.net/uploads/2020/07/Online-Games-Barbarism-and-Civilization-180x240.jpg.webp,Online Games Barbarism and Civilization,OGBC,网游野蛮与文明,Dropped,Only like lean meat,Game,"Bullying, Clan Building, Game Ranking System, Harem, Harem-seeking Protagonist, Imperial Harem, Kingdom Building, System, System Administrator"
https://www.mtlnovel.com/buy-a-golden-finger/,https://www.mtlnovel.net/uploads/2020/07/Buy-a-Golden-Finger-180x240.jpg.webp,Buy a Golden Finger,BGF,买个金手指吧,Dropped,Fenglin night sitting,"Fantasy, Xuanhuan","Male Protagonist, System Administrator"
https://www.mtlnovel.com/reborn-as-kobe/,https://www.mtlnovel.net/uploads/2020/07/Reborn-as-Kobe-180x240.jpg.webp,Reborn as Kobe,RaK,重生成为科比,Dropped,Write poems before the first snow,Sports,"Basketball, Business Management"
https://www.mtlnovel.com/the-first-immortal-of-the-heavens/,https://www.mtlnovel.net/uploads/2020/07/The-First-Immortal-of-the-Heavens-180x240.jpg.webp,The First Immortal of the Heavens,FIOTH,诸天第一仙,Dropped,Aotian Wuhen,"Fantasy, Xianxia","Absent Parents, Fast Cultivation, Fast Learner, Genius Protagonist, Harem, Naive Protagonist"
https://www.mtlnovel.com/strengthening-and-upgrading-the-opening-god-level-options/,https://www.mtlnovel.net/uploads/2020/07/Strengthening-and-Upgrading-the-Opening-God-level-Options-180x240.jpg.webp,Strengthening and Upgrading the Opening God-level Options,SUOGO,开局神级选项强化升级,Dropped,Personable,Urban Life,"Cheats, Discrimination, Game Elements, Gamers, Male Protagonist, Smart Couple, System Administrator"
https://www.mtlnovel.com/im-a-baller/,https://www.mtlnovel.net/uploads/2020/07/Im-A-Baller-180x240.jpg.webp,I’m A Baller,IAB,生活系男神,Dropped,Short'nin' Bread,Urban Life,"Harem, Harem-seeking Protagonist, Level System, Masochistic Characters, Modern, Nationalism, Poor to Rich, Sudden Wealth, System"
https://www.mtlnovel.com/urban-god-level-selection-system/,https://www.mtlnovel.net/uploads/2020/07/Urban-God-level-Selection-System-180x240.jpg.webp,Urban God-level Selection System,UGLSS,都市之神级选择系统,Dropped,Crazy carat,"Action, Adventure, Fantasy, Urban Life, Xuanhuan","Beautiful Female Lead, Cheats, Handsome Male Lead, Harem, Male Protagonist, Poor to Rich, Sudden Wealth, System, System Administrator"
https://www.mtlnovel.com/super-gene-optimization-solution/,https://www.mtlnovel.net/uploads/2020/09/Super-Gene-Optimization-Fluid-180x240.jpg.webp,Super Gene Optimization Fluid (Super Gene Optimization Solution),SGOS,超级基因优化液 / Super Gene Optimization Solution,Dropped,Nine Light Years Per Second,"Action, Adventure, Sci-fi","Academy, Alchemy, Assassins, Beautiful Female Lead, Calm Protagonist, Clever Protagonist, Cosmic Wars, Cultivation, Cunning Protagonist, Determined Protagonist, Friendship, Futuristic Setting, Genetic Modifications, Magical Space, Male Protagonist, Martial arts, Mercenaries, Modern Day, Modern Knowledge, Organized Crime, Secret Organizations, Spaceship, Spatial Manipulation, Weak to Strong"
https://www.mtlnovel.com/football-king-bale/,https://www.mtlnovel.net/uploads/2020/07/Football-King-Bale-180x240.jpg.webp,Football King Bale,FKB,大圣贝尔,Dropped,Red Devil Legend,Sports,"Football, Playboys, Soccer, System"
https://www.mtlnovel.com/i-am-a-magic-sword/,https://www.mtlnovel.net/uploads/2020/07/i-am-a-magic-sword.jpg.webp,I Am a Magic Sword,IAMS,我是一把魔剑,Dropped,Worry-Free Dance,"Action, Fantasy, Martial Arts, Xianxia","Ability Steal, Assassins, Cultivation, Demonic Cultivation Technique, Elemental Magic, Evil Protagonist, Fast Cultivation, Master-Disciple Relationship, Military, Multiple Protagonists, Murders, Non-humanoid Protagonist, Reincarnated as an Object, Ruthless Protagonist, Selfish Protagonist, Skill Assimilation, System Administrator"
https://www.mtlnovel.com/killing-god-island/,https://www.mtlnovel.net/uploads/2020/07/Killing-God-Island-180x240.jpg.webp,Killing God Island,KGI,杀神岛,Dropped,Ghost Eye Butcher,Fantasy,
https://www.mtlnovel.com/ultimate-weapon-of-magic-and-science/,https://www.mtlnovel.net/uploads/2020/07/Ultimate-Weapon-of-Magic-and-Science-180x240.jpg.webp,Ultimate Weapon of Magic and Science,UWMS,魔法与科学的最终兵器,Dropped,Millennium Empire Naval Colonel,"Action, Adventure, Fantasy, Xuanhuan","Adapted to Manga, Dragons, Industrialization, Kingdom Building"
https://www.mtlnovel.com/bitter-entertainment-critic/,https://www.mtlnovel.net/uploads/2020/07/Bitter-Entertainment-Critic-180x240.jpg.webp,Bitter Entertainment Critic,BEC,娱乐大喷子,Dropped,Lazy cat sticking out tongue,"Romance, Urban Life",System Administrator
https://www.mtlnovel.com/my-enhanceable-equipment/,https://www.mtlnovel.net/uploads/2020/07/My-Enhanceable-Equipment-180x240.jpg.webp,My Enhanceable Equipment,MEE,我的物品能升级,Dropped,,Sci-fi,"Artifact Crafting, Artifacts, Male Protagonist, Poor to Rich, System, System Administrator"
https://www.mtlnovel.com/immortal-world-supplier/,https://www.mtlnovel.net/uploads/2020/07/Immortal-World-Supplier-180x240.jpg.webp,Immortal World Supplier,IWS,仙界供应商,Dropped,Zhu Fu,"Fantasy, Romance, Wuxia, Xianxia","Businessmen, Male Protagonist, Store Owner, System"
https://www.mtlnovel.com/invincible-undead-legion/,https://www.mtlnovel.net/uploads/2020/07/Invincible-Undead-Legion-180x240.jpg.webp,Invincible Undead Legion,IUL,无敌亡灵军团,Dropped,Wen Zhan,"Action, Adventure, Fantasy, Urban Life, Xuanhuan","Army Building, Cheats, Necromancer, Reincarnated as a Monster"
https://www.mtlnovel.com/i-cant-upgrade-so-fast/,https://www.mtlnovel.net/uploads/2020/06/I-Cant-Upgrade-So-Fast-180x240.jpg.webp,I Can’t Upgrade So Fast,ICUSF,我升级不可能这么快,Dropped,Yu Wan Wan O Ye,Sci-fi,
https://www.mtlnovel.com/pick-up-attributes-martial-arts/,https://www.mtlnovel.net/uploads/2020/06/Pick-Up-Attributes-Martial-Arts-180x240.jpg.webp,Pick Up Attributes Martial Arts,PUAMA,捡属性武道,Dropped,Thousands of dreams,"Action, Adventure, Fantasy, Martial Arts, Xuanhuan","Ability Steal, Army, Battle Academy, Doting Parents, Evolution, Fast Cultivation, Loyal Subordinates, Monsters, Overpowered Protagonist, Pets, System"
https://www.mtlnovel.com/i-do-not-want-to-inherit-the-family-fortune/,https://www.mtlnovel.net/uploads/2020/06/i-do-not-want-to-inherit-the-family-fortune-180x240.jpg.webp,I Do Not Want to Inherit the Family Fortune,IDWIFF,我不想继承万亿家产,Dropped,会抽烟的于大爷,"Drama, Psychological, Romance, Slice of Life","Absent Parents, Arrogant Characters, Childcare, Complex Family Relationships, Emotionally Weak Protagonist, Familial Love, Family Business, Family Conflict, Marriage, Mysterious Past, Naive Protagonist, Office Romance, Poor to Rich, Tragic Past, Unconditional Love"
https://www.mtlnovel.com/salted-fish-learn-to-play-technology/,https://www.mtlnovel.net/uploads/2020/06/Salted-Fish-Learn-to-Play-Technology-180x240.jpg.webp,Salted Fish Learn to Play Technology,SFLPT,咸鱼学霸玩科技,Dropped,Happy,Urban Life,"Apathetic Protagonist, Game Elements, Lazy Protagonist, Male Protagonist, Protagonist Strong from the Start, System Administrator"
https://www.mtlnovel.com/battle-of-the-third-reich/,https://www.mtlnovel.net/uploads/2020/06/battle-of-the-third-reich-180x240.jpg.webp,Battle of the Third Reich,BTR,复活之战斗在第三帝国,Dropped,Feng Rui,"Action, Adventure, Drama, Historical","Army, Army Building, Domestic Affairs, European Ambience, Famous Protagonist, Kingdom Building, Male Protagonist, Nationalism, Transmigration, Wars"
https://www.mtlnovel.com/doomed-to-be-a-king/,https://www.mtlnovel.net/uploads/2020/06/Doomed-To-Be-A-King.jpg.webp,Doomed To Be A King (Conquer a Mountain And Become The Great King),DTBAK,占个山头当大王 / Conquer a Mountain And Become The Great King,Dropped,Kinoshita Kiji Mizu,"Action, Adventure, Fantasy, Martial Arts, Xuanhuan","Adapted to Manhua, Beautiful Female Lead, Farming, Harem, Kingdom Building, Male Protagonist, System, Unique Cultivation Technique"
https://www.mtlnovel.com/rebirth-of-the-campus-bussiness-woman-at-age-18/,https://www.mtlnovel.net/uploads/2020/06/rebirth-of-the-campus-bussiness-woman-at-age-18-180x240.jpg.webp,Rebirth of the Campus Bussiness Woman at Age 18,RCBW,重生校园之商女十八岁,Dropped,后情,"Drama, Josei, Romance, Supernatural",Identity Crisis
https://www.mtlnovel.com/urban-supreme-system/,https://www.mtlnovel.net/uploads/2020/06/Urban-Supreme-System-180x240.jpg.webp,Urban Supreme System,USS,都市至尊系统,Dropped,Scent in the glass,Urban Life,"Adapted to Manhua, Beautiful Female Lead, Complex Family Relationships, Cultivation, Eye Powers, Handsome Male Lead, Late Romance, Marriage, Poor to Rich, Siblings Not Related by Blood, System, System Administrator, World Hopping"
https://www.mtlnovel.com/i-shocked-the-globe/,https://www.mtlnovel.net/uploads/2020/06/I-Shocked-the-Globe-1-180x240.jpg.webp,I Shocked the Globe,ISTG,我又轰动全球了,Dropped,Is It Cool,"Romance, Sci-fi","Cute Protagonist, Devoted Love Interests, Doting Love Interests, Female Protagonist, Transmigration, Vampires, World Hopping"
https://www.mtlnovel.com/the-mightiest-little-peasant/,https://www.mtlnovel.net/uploads/2020/06/The-Mightiest-Little-Peasant-1-180x240.jpg.webp,The Mightiest Little Peasant,TMLP,最强小农民,Dropped,Watermelonian,"Action, Fantasy, Urban Life, Xuanhuan","Abusive Characters, Alchemy, Aliens, Archery, Arrogant Characters, Artifact Crafting, Artifacts, Assassins, Battle Academy, Beasts, Beautiful Female Lead, Boss-Subordinate Relationship, Business Management, Businessmen, Celebrities, Clever Protagonist, Clever Protagonist Cultivation, College/University, Comedic Undertone, Cooking, Corruption, Cultivation, Cunning Protagonist, Cute Protagonist, Daoism, Demons, Determined Protagonist, Doctors, Dragons, Eidetic Memory, Enemies Become Lovers, Fairies, Famous Protagonist, Farming, Fast Cultivation, Feng Shui, Fox Spirits, Friendship, Gate to Another World, Genies, Genius Protagonist, Hard-Working Protagonist, Harem, Healers, Herbalist, Hidden Abilities, Hiding True Abilities, Inscriptions, Leadership, Low-key Protagonist, Magic, Magical Space, Male Protagonist, Martial arts, Medical Knowledge, Military, Modern Day, Modern World, Money Grubber, Monsters, Outer Space, Part-Time Job, Pill Based Cultivation, Pill Concocting, Police, Polygamy, Poor to Rich, Pretend Lovers, Restaurant, Schemes And Conspiracies, Secret Identity, Secret Organizations, Sharp-tongued Characters, Spatial Manipulation, Urban, Vampires, Virtual Reality, Wars, Weak to Strong, Werebeasts, Wizards, Zombies"
https://www.mtlnovel.com/bank-of-the-universe/,https://www.mtlnovel.net/uploads/2020/06/bank-of-the-universe-180x240.jpg.webp,Bank of The Universe,BOTU,我有一座天地钱庄,Dropped,Girl Wears Short Skirt,"Action, Adventure, Comedy, Romance, Xuanhuan","Business Management, Cultivation, Fast Cultivation, Gods, Handsome Male Lead, Immortals, Loyal Subordinates, Mythical Beasts, Mythology"
https://www.mtlnovel.com/the-clamoring-hydra/,https://www.mtlnovel.net/uploads/2020/06/The-clamoring-Hydra-180x240.jpg.webp,The Clamoring Hydra,TCH,叫嚣的海德拉,Dropped,Mr. Li Zhai,"Action, Adventure, Fantasy, Xuanhuan","Gods, Harem, Reincarnated as a Monster, Siblings, Strong from the Start, Strong to Stronger, Transmigration, Weak to Strong"
https://www.mtlnovel.com/the-cruelty-of-the-nba/,https://www.mtlnovel.net/uploads/2020/06/The-Cruelty-of-the-NBA-180x240.jpg.webp,The Cruelty of the NBA,CNBA,NBA之残暴,Dropped,Flying 123,Sports,Basketball
https://www.mtlnovel.com/i-can-improve-perception/,https://www.mtlnovel.net/uploads/2020/05/I-Can-Improve-Perception-180x240.jpg.webp,I Can Improve Perception,ICIP,我能提升悟性,Dropped,I Love Keyboard,"Fantasy, Xuanhuan","Game Elements, Level System, Multiple Realms, System Administrator"
https://www.mtlnovel.com/the-god-of-basketball/,https://www.mtlnovel.net/uploads/2020/05/The-God-of-Basketball-180x240.jpg.webp,The God of Basketball,GoB,是篮球之神啊,Dropped,Kuai Jian Jiang Hu,Sports,"Basketball, Celebrities, Harem, Showbiz"
https://www.mtlnovel.com/the-traverser-of-marvel-world/,https://www.mtlnovel.net/uploads/2020/05/The-Traverser-of-Marvel-World.jpg.webp,The Traverser of Marvel World,TMW,漫威世界的穿越者,Dropped,There is Wei Xiaobao at Home,"Action, Adventure, Fan-Fiction, Sci-fi","Alternate World, Based on a Movie, Fan-fiction, Fanfiction, Male Protagonist, Marvel, System Administrator, Time Skip, World Travel"
https://www.mtlnovel.com/altar-of-the-heavens-of-harry-potter/,https://www.mtlnovel.net/uploads/2020/05/Altar-of-the-Heavens-of-Harry-Potter-180x240.jpg.webp,Altar of the Heavens of Harry Potter,AHHP,哈利波特之诸天祭坛,Dropped,Chaicha Shaonian,"Action, Adventure, Fan-Fiction, Fantasy, Xuanhuan","Fan-fiction, Harry Potter, Male Protagonist, Marvel, Pokemon"
https://www.mtlnovel.com/china-has-table-tennis/,https://www.mtlnovel.net/uploads/2020/05/China-Has-Table-Tennis-180x240.jpg.webp,China Has Table Tennis,CHTT,中国有乒乓,Dropped,,Sports,"Table Tennis, Tennis"
https://www.mtlnovel.com/invincible-kungfu-healer/,https://www.mtlnovel.net/uploads/2020/05/invincible-kungfu-healer-180x240.jpg.webp,Invincible Kungfu Healer,IKH,功夫圣医,Dropped,Azuresky,"Action, Comedy, Fantasy, Harem, Martial Arts, Romance, School Life","Alchemy, Androgynous Characters, Arrogant Characters, Assassins, Beasts, Beautiful Female Lead, Calm Protagonist, Clever Protagonist, College/University, Confident Protagonist, Doctors, Dolls/Puppets, Evil Organizations, Ghosts, Handsome Male Lead, Hard-Working Protagonist, Harem, Herbalist, Honest Protagonist, Magical Space, Male Protagonist, Medical Knowledge, Modern Day, Outer Space, Past Plays a Big Role, Pill Concocting, Pill Concoting, Poor Protagonist, Poor to Rich, Ruthless Protagonist, Schemes And Conspiracies, Spatial Manipulation, Underestimated Protagonist, Urban, Vampires, Weak to Strong"
https://www.mtlnovel.com/super-theological-academy-to-conquer-the-world/,https://www.mtlnovel.net/uploads/2020/05/Super-Theological-Academy-to-Conquer-the-World-180x240.jpg.webp,Super Theological Academy to Conquer the World,STACW,从超神学院开始征服万界,Dropped,Good Melon,Sci-fi,"Fan-fiction, Game Elements, System Administrator, World Travel"
https://www.mtlnovel.com/magic-race-crossing/,https://www.mtlnovel.net/uploads/2020/05/Magic-Race-Crossing-180x240.jpg.webp,Magic Race Crossing,MRC,魔法种族大穿越,Dropped,,Sci-fi,"Aliens, Apocalypse, Cruel Characters, Cultivation, Cunning Protagonist, Demon Lord, Demonic Cultivation Technique, Demons, Depictions of Cruelty, Dragons, Elves, Evil Protagonist, Fan-fiction, Fanfiction, Fantasy Creatures, Game Elements, Gods, Human Experimentation, Inheritance, Interdimensional Travel, Magic, Male Protagonist, Monsters, Movies, Multiple Realms, Multiple Transported Individuals, Personality Changes, Race Change, Romantic Subplot, Ruthless Protagonist, Special Abilities, Sword And Magic, Transported into Another World, Unique Cultivation Technique, Weak to Strong"
https://www.mtlnovel.com/fighting-the-galaxy/,https://www.mtlnovel.net/uploads/2020/05/Fighting-The-Galaxy-180x240.jpg.webp,Fighting The Galaxy,FtG,鏖战银河,Dropped,,"Adult, Adventure, Sci-fi","Outer Space, Spaceship"
https://www.mtlnovel.com/master-of-the-stars/,https://www.mtlnovel.net/uploads/2020/04/master-of-the-stars-180x240.jpg.webp,Master of the Stars (The Lord of the Stars),MotS,星辰之主 / The Lord of the Stars,Dropped,Weight Loss Expert,"Action, Fantasy, Martial Arts, Mystery, Sci-fi, Seinen, Xuanhuan","Army, Artifacts, Bodyguards, Calm Protagonist, Cultivation, Gate to Another World, Loner Protagonist, Male Protagonist, Manipulative Characters, Modern Day, Mutated Creatures, Politics, Schemes And Conspiracies, Special Abilities, Tragic Past"
https://www.mtlnovel.com/reincarnation-of-the-heaven/,https://www.mtlnovel.net/uploads/2020/04/reincarnation-of-the-heaven-180x240.jpg.webp,Reincarnation of the Heaven,ROTH,诸天重生,Dropped,ManMan Tiansheng,"Action, Adventure, Comedy, Fantasy, Harem, Xuanhuan","Adultery, Aggressive Characters, Calm Protagonist, Clever Protagonist, Crafting, Demons, Fast Cultivation, Fast Learner, Genius Protagonist, Hard-Working Protagonist, Harem, Heaven, Heavenly Tribulation, Honest Protagonist, Immortals, Male Protagonist, Misunderstandings, Multiple Realms, Past Plays a Big Role, Polygamy, Reincarnation, Revenge, Romantic Subplot, Shameless Protagonist, Skill Creation, Sword And Magic, Weak to Strong"
https://www.mtlnovel.com/super-electric-eel-avatar/,https://www.mtlnovel.net/uploads/2020/04/super-electric-eel-avatar-180x240.jpg.webp,Super Electric Eel Avatar,SEEA,超级电鳗分身,Dropped,The sheathed sword,"Action, Adventure, Fantasy, Supernatural","Genetic Modifications, Male Protagonist, Mutations, Pirates, Poor to Rich"
https://www.mtlnovel.com/this-game-will-kill/,https://www.mtlnovel.net/uploads/2020/04/this-game-will-kill-180x240.jpg.webp,This Game Will Kill,TGWK,这个游戏会死人,Dropped,大木老湿,Horror,"Game Elements, Game Ranking System"
https://www.mtlnovel.com/restricted-doomsday-syndrome/,https://www.mtlnovel.net/uploads/2020/04/restricted-doomsday-syndrome-180x240.jpg.webp,Restricted Doomsday Syndrome,RDS,限制级末日症候,Dropped,全部成为F,"Action, Fantasy, Horror, Mystery, Supernatural",Apocalypse
https://www.mtlnovel.com/transcending-evolution/,https://www.mtlnovel.net/uploads/2020/04/transcending-evolution-180x240.jpg.webp,Transcending Evolution,TE,超能进化,Dropped,撒加,"Action, Drama, Fantasy, Martial Arts, School Life, Sci-fi, Tragedy, Xuanhuan","Apocalypse, Artifacts, Betrayal, Body Tempering, Cultivation, Evolution, Magic Beasts, Male Protagonist, Monsters, Rape, Special Abilities, Weak to Strong"
https://www.mtlnovel.com/the-ogres-food-box/,https://www.mtlnovel.net/uploads/2020/04/the-ogre-s-food-box.jpg.webp,The Ogre’s Food Box,OFB,食人魔的美食盒,Dropped,黑籍,"Action, Adventure, Comedy, Fantasy","Beastkin, Demi-Humans, Demons, Depictions of Cruelty, Dragons, Dwarfs, Elves, Fantasy World, Gods, Gore, Humanoid Protagonist, Kingdoms, Magic, Male Protagonist, Monsters, Orcs, Ruthless Protagonist, Strength-based Social Hierarchy, Survival, Weak to Strong, World Travel"
https://www.mtlnovel.com/a-new-age-of-magic/,https://www.mtlnovel.net/uploads/2020/04/a-new-age-of-magic-180x240.jpg.webp,A New Age of Magic,ANAM,魔法新时代,Dropped,Liang Maoshuai,"Adventure, Fantasy, Mystery, Sci-fi","Kingdoms, Magic, Male Protagonist, Transmigration"
